{
  "$schema": "https://json-schema.org/draft/2020-12/schema",
  "$id": "https://dotfiles.local/schemas/flow.production-route-conformance-evidence.v1.schema.json",
  "title": "flow.production-route-conformance-evidence/v1",
  "type": "object",
  "additionalProperties": false,
  "required": [
    "schema",
    "release_id",
    "qualification_base_commit",
    "candidate_tree_sha",
    "release_content_digest",
    "status",
    "scope",
    "routes",
    "assertions",
    "phase1_evidence_sha256",
    "generation_id",
    "generation_binding_sha256",
    "recipe",
    "captured_at",
    "environment"
  ],
  "properties": {
    "schema": { "const": "flow.production-route-conformance-evidence/v1" },
    "release_id": { "type": "string", "minLength": 1 },
    "qualification_base_commit": { "type": "string", "pattern": "^[0-9a-f]{40}$" },
    "candidate_tree_sha": { "type": "string", "pattern": "^[0-9a-f]{40}$" },
    "release_content_digest": { "$ref": "#/$defs/digest" },
    "status": { "enum": ["passed", "failed", "blocked", "not_run", "running"] },
    "scope": { "const": "production_public_route_conformance" },
    "routes": {
      "type": "array",
      "minItems": 2,
      "items": { "$ref": "#/$defs/route" }
    },
    "assertions": {
      "type": "array",
      "minItems": 1,
      "items": { "type": "string", "minLength": 1 }
    },
    "phase1_evidence_sha256": {
      "oneOf": [
        { "type": "null" },
        { "type": "string", "pattern": "^[0-9a-f]{64}$" }
      ]
    },
    "generation_id": {
      "oneOf": [
        { "type": "null" },
        { "type": "string", "pattern": "^[0-9a-f-]{36}$" }
      ]
    },
    "generation_binding_sha256": {
      "oneOf": [
        { "type": "null" },
        { "type": "string", "pattern": "^[0-9a-f]{64}$" }
      ]
    },
    "recipe": {
      "oneOf": [
        { "type": "null" },
        { "$ref": "#/$defs/recipe" }
      ]
    },
    "captured_at": {
      "type": "string",
      "pattern": "^\\d{4}-\\d{2}-\\d{2}T\\d{2}:\\d{2}:\\d{2}Z$"
    },
    "environment": {
      "type": "object",
      "additionalProperties": false,
      "required": ["os", "architecture", "node", "npm", "git"],
      "properties": {
        "os": { "type": "string", "minLength": 1 },
        "architecture": { "type": "string", "minLength": 1 },
        "node": { "type": "string", "minLength": 1 },
        "npm": { "type": "string", "minLength": 1 },
        "git": { "type": "string", "minLength": 1 }
      }
    }
  },
  "allOf": [
    {
      "if": { "properties": { "status": { "const": "not_run" } } },
      "then": {
        "properties": {
          "phase1_evidence_sha256": { "type": "null" },
          "generation_id": { "type": "null" },
          "generation_binding_sha256": { "type": "null" },
          "recipe": { "type": "null" }
        }
      }
    },
    {
      "if": { "properties": { "status": { "const": "running" } } },
      "then": {
        "properties": {
          "phase1_evidence_sha256": { "type": "string", "pattern": "^[0-9a-f]{64}$" },
          "generation_id": { "type": "string", "pattern": "^[0-9a-f-]{36}$" },
          "generation_binding_sha256": { "type": "string", "pattern": "^[0-9a-f]{64}$" },
          "recipe": { "type": "null" }
        }
      }
    },
    {
      "if": { "properties": { "status": { "const": "passed" } } },
      "then": {
        "properties": {
          "phase1_evidence_sha256": { "type": "string", "pattern": "^[0-9a-f]{64}$" },
          "generation_id": { "type": "null" },
          "generation_binding_sha256": { "type": "null" },
          "recipe": { "$ref": "#/$defs/recipe" }
        }
      }
    }
  ],
  "$defs": {
    "digest": {
      "type": "string",
      "pattern": "^sha256:[0-9a-f]{64}$"
    },
    "route": {
      "type": "object",
      "additionalProperties": false,
      "required": ["flow", "mode"],
      "properties": {
        "flow": { "type": "string", "minLength": 1 },
        "mode": { "type": "string", "minLength": 1 }
      }
    },
    "recipe": {
      "type": "object",
      "additionalProperties": false,
      "required": ["schema", "digest", "commands"],
      "properties": {
        "schema": { "const": "flow.production-route-conformance-recipe/v1" },
        "digest": { "$ref": "#/$defs/digest" },
        "commands": {
          "type": "array",
          "minItems": 1,
          "items": { "$ref": "#/$defs/command" }
        }
      }
    },
    "command": {
      "type": "object",
      "additionalProperties": false,
      "required": ["id", "command", "working_directory", "receipt_path", "receipt_sha256", "status", "exit_code", "tests", "passed", "failed", "cancelled", "skipped", "flaky"],
      "properties": {
        "id": { "type": "string", "minLength": 1 },
        "command": { "type": "string", "minLength": 1 },
        "working_directory": { "type": "string", "minLength": 1 },
        "receipt_path": { "type": "string", "minLength": 1 },
        "receipt_sha256": { "type": "string", "pattern": "^[0-9a-f]{64}$" },
        "status": { "const": "passed" },
        "exit_code": { "const": 0 },
        "tests": { "type": "integer", "minimum": 1 },
        "passed": { "type": "integer", "minimum": 1 },
        "failed": { "const": 0 },
        "cancelled": { "const": 0 },
        "skipped": { "const": 0 },
        "flaky": { "const": 0 }
      }
    }
  }
}
