{
  "schema": "flow.production-route-conformance-evidence/v1",
  "release_id": "flow-release-1.0-dark/v1",
  "qualification_base_commit": "a4a9a88a330be2b668339cf1a9b1b7c1b992564e",
  "candidate_tree_sha": "310e6a0146ee2ba2384df344300440bf55d8a09b",
  "release_content_digest": "sha256:b8043b8f23a2998de9d4e6a931970956d5a5266f47a5f641ae394d73f57c3469",
  "status": "not_run",
  "scope": "production_public_route_conformance",
  "routes": [
    {
      "flow": "feature",
      "mode": "verify"
    },
    {
      "flow": "review",
      "mode": "local"
    }
  ],
  "assertions": [
    "real production feature verify mutates and verifies a local candidate through production runtime, gate, composition, workspace authority, and deterministic Drovr-port adapter",
    "public local review prepares and launches through production runtime, gate, composition, review authority, and inbox projection",
    "production route cases use isolated local repositories and do not authorize remote mutations"
  ],
  "phase1_evidence_sha256": null,
  "generation_id": null,
  "generation_binding_sha256": null,
  "recipe": null,
  "captured_at": "2026-10-22T23:33:57Z",
  "environment": {
    "os": "darwin",
    "architecture": "arm64",
    "node": "v22.23.1",
    "npm": "10.9.8",
    "git": "2.50.1 (Apple Git-155)"
  }
}
